texto;toxico;num_admir;num_may;num_may_esc;emojis;num_emoji;num_insultos;dir_23ps;score_emoji_tox;emphasize;series_token2;series_token;filtered_words
segun este lumbreras, se los debieron enviar los americanos.;1.0;0;0;0.0;;0;0;1;0.0;1.0;segun este lumbreras, se los debieron enviar los americanos.;['segun', 'este', 'lumbreras', ',', 'se', 'los', 'debieron', 'enviar', 'los', 'americanos', '.'];['segun', 'lumbreras,', 'debieron', 'enviar', 'americanos.']
gracias por la info lumbreras.;1.0;0;1;0.2;;0;0;0;0.0;0.2;gracias por la info lumbreras.;['gracias', 'por', 'la', 'info', 'lumbreras', '.'];['gracias', 'info', 'lumbreras.']
pero el lumbreras de no lo sabe. 😎;1.0;0;0;0.0;😎;1;1;0;0.491;0.0;pero el lumbreras de no lo sabe. 😎;['pero', 'el', 'lumbreras', 'de', 'no', 'lo', 'sabe', '.', '😎'];['lumbreras', 'no', 'sabe.', '😎']
al lumbreras que se le ocurrio poner garbanzos a los frutos secos al gulag y ni agua.;1.0;0;0;0.0;;0;1;0;0.0;0.0;al lumbreras que se le ocurrio poner garbanzos a los frutos secos al gulag y ni agua.;['al', 'lumbreras', 'que', 'se', 'le', 'ocurrio', 'poner', 'garbanzos', 'a', 'los', 'frutos', 'secos', 'al', 'gulag', 'y', 'ni', 'agua', '.'];['lumbreras', 'ocurrio', 'poner', 'garbanzos', 'frutos', 'secos', 'gulag', 'agua.']
mi hija tiene de media. y calcula que ha sacado un .3 ella queria hacer grado de mates hace tiempo. ahora ingenieria informatica. al menos en esta l nota de corte es baja. felicidades a los lumbreras que pusieron el examen. el dia q den las notas veremos que pasa. pau2019;1.0;0;0;0.0;;0;1;1;0.0;1.0;mi hija tiene de media. y calcula que ha sacado un .3 ella queria hacer grado de mates hace tiempo. ahora ingenieria informatica. al menos en esta l nota de corte es baja. felicidades a los lumbreras que pusieron el examen. el dia q den las notas veremos que pasa. pau2019;['mi', 'hija', 'tiene', 'de', 'media', '.', 'y', 'calcula', 'que', 'ha', 'sacado', 'un', '.3', 'ella', 'queria', 'hacer', 'grado', 'de', 'mates', 'hace', 'tiempo', '.', 'ahora', 'ingenieria', 'informatica', '.', 'al', 'menos', 'en', 'esta', 'l', 'nota', 'de', 'corte', 'es', 'baja', '.', 'felicidades', 'a', 'los', 'lumbreras', 'que', 'pusieron', 'el', 'examen', '.', 'el', 'dia', 'q', 'den', 'las', 'notas', 'veremos', 'que', 'pasa', '.', 'pau2019'];['hija', 'media.', 'calcula', 'sacado', '.3', 'queria', 'hacer', 'grado', 'mates', 'hace', 'tiempo.', 'ahora', 'ingenieria', 'informatica.', 'menos', 'l', 'nota', 'corte', 'baja.', 'felicidades', 'lumbreras', 'pusieron', 'examen.', 'dia', 'q', 'den', 'notas', 'veremos', 'pasa.', 'pau2019']
pues si hubiesen castrado a tu padre tu no hubieses nacido lumbreras;1.0;0;0;0.0;;0;1;1;0.0;1.0;pues si hubiesen castrado a tu padre tu no hubieses nacido lumbreras;['pues', 'si', 'hubiesen', 'castrado', 'a', 'tu', 'padre', 'tu', 'no', 'hubieses', 'nacido', 'lumbreras'];['pues', 'castrado', 'padre', 'no', 'nacido', 'lumbreras']
dos nuevas familias han encontrado su hogar con nosotros. ¿quieres ser la siguiente?. trabajamos en puerto lumbreras, lorca, totana, caravaca de la cruz, calasparra, mula y cehegin. !dinos lo que buscas y te ayudaremos a encontrarlo! 🗝️ 🏠 👏🏼 👥 • inmobiliaria morillas hogar;0.0;2;0;0.0;🗝 🏠 👏 👥;4;0;1;0.0;3.0;dos nuevas familias han encontrado su hogar con nosotros. ¿quieres ser la siguiente?. trabajamos en puerto lumbreras, lorca, totana, caravaca de la cruz, calasparra, mula y cehegin. !dinos lo que buscas y te ayudaremos a encontrarlo! 🗝️ 🏠 👏🏼 👥 • inmobiliaria morillas hogar;['dos', 'nuevas', 'familias', 'han', 'encontrado', 'su', 'hogar', 'con', 'nosotros', '.', '¿quieres', 'ser', 'la', 'siguiente', '?', '.', 'trabajamos', 'en', 'puerto', 'lumbreras', ',', 'lorca', ',', 'totana', ',', 'caravaca', 'de', 'la', 'cruz', ',', 'calasparra', ',', 'mula', 'y', 'cehegin', '.', '!', 'dinos', 'lo', 'que', 'buscas', 'y', 'te', 'ayudaremos', 'a', 'encontrarlo', '!', '🗝️', '🏠', '👏🏼', '👥', '•', 'inmobiliaria', 'morillas', 'hogar'];['dos', 'nuevas', 'familias', 'encontrado', 'hogar', 'nosotros.', '¿quieres', 'ser', 'siguiente?.', 'trabajamos', 'puerto', 'lumbreras,', 'lorca,', 'totana,', 'caravaca', 'cruz,', 'calasparra,', 'mula', 'cehegin.', '!dinos', 'buscas', 'ayudaremos', 'encontrarlo!', '🗝️', '🏠', '👏🏼', '👥', '•', 'inmobiliaria', 'morillas', 'hogar']
14h puerto lumbreras: temp. .9 °c, hum. %, bar. .6 hpa, lluvia .0 mm, viento .8 km/h sse weathercloud;0.0;0;3;0.15;;0;0;0;0.0;0.15;14h puerto lumbreras: temp. .9 °c, hum. %, bar. .6 hpa, lluvia .0 mm, viento .8 km/h sse weathercloud;['14h', 'puerto', 'lumbreras', ':', 'temp', '.', '.9', '°c', ',', 'hum', '.', '%', ',', 'bar', '.', '.6', 'hpa', ',', 'lluvia', '.0', 'mm', ',', 'viento', '.8', 'km/h', 'sse', 'weathercloud'];['14h', 'puerto', 'lumbreras:', 'temp.', '.9', '°c,', 'hum.', '%,', 'bar.', '.6', 'hpa,', 'lluvia', '.0', 'mm,', 'viento', '.8', 'km/h', 'sse', 'weathercloud']
lo ha sido, por eso setien esta despedido. lumbreras;1.0;0;0;0.0;;0;1;1;0.0;1.0;lo ha sido, por eso setien esta despedido. lumbreras;['lo', 'ha', 'sido', ',', 'por', 'eso', 'setien', 'esta', 'despedido', '.', 'lumbreras'];['sido,', 'setien', 'despedido.', 'lumbreras']
donald trump patan o macarra barriobajero?;1.0;0;0;0.0;;0;1;0;0.0;0.0;donald trump patan o macarra barriobajero?;['donald', 'trump', 'patan', 'o', 'macarra', 'barriobajero', '?'];['donald', 'trump', 'patan', 'macarra', 'barriobajero?']
rata mora fue pesimo y barriobajero,que tio mas asqueroso,fuera de salvame ya!!!;1.0;3;0;0.0;;0;0;0;0.0;3.0;rata mora fue pesimo y barriobajero,que tio mas asqueroso,fuera de salvame ya!!!;['rata', 'mora', 'fue', 'pesimo', 'y', 'barriobajero', ',', 'que', 'tio', 'mas', 'asqueroso', ',', 'fuera', 'de', 'salvame', 'ya', '!', '!', '!'];['rata', 'mora', 'pesimo', 'barriobajero,que', 'tio', 'mas', 'asqueroso,fuera', 'salvame', 'ya!!!']
ruben cruz acabara mal . es un barriobajero;1.0;0;0;0.0;;0;1;0;0.0;0.0;ruben cruz acabara mal . es un barriobajero;['ruben', 'cruz', 'acabara', 'mal', '.', 'es', 'un', 'barriobajero'];['ruben', 'cruz', 'acabara', 'mal', '.', 'barriobajero']
me recuerda a las ostias q repartia el barriobajero madrid de mou en los cladicos, a mamar;1.0;0;0;0.0;;0;1;0;0.0;0.0;me recuerda a las ostias q repartia el barriobajero madrid de mou en los cladicos, a mamar;['me', 'recuerda', 'a', 'las', 'ostias', 'q', 'repartia', 'el', 'barriobajero', 'madrid', 'de', 'mou', 'en', 'los', 'cladicos', ',', 'a', 'mamar'];['recuerda', 'ostias', 'q', 'repartia', 'barriobajero', 'madrid', 'mou', 'cladicos,', 'mamar']
vaya codazo barriobajero;1.0;0;0;0.0;;0;1;0;0.0;0.0;vaya codazo barriobajero;['vaya', 'codazo', 'barriobajero'];['vaya', 'codazo', 'barriobajero']
juego sucio no, barriobajero.;1.0;0;0;0.0;;0;0;0;0.0;0.0;juego sucio no, barriobajero.;['juego', 'sucio', 'no', ',', 'barriobajero', '.'];['juego', 'sucio', 'no,', 'barriobajero.']
espero que pida perdon por esta accion de barriobajero paleto.;1.0;0;0;0.0;;0;1;1;0.0;1.0;espero que pida perdon por esta accion de barriobajero paleto.;['espero', 'que', 'pida', 'perdon', 'por', 'esta', 'accion', 'de', 'barriobajero', 'paleto', '.'];['espero', 'pida', 'perdon', 'accion', 'barriobajero', 'paleto.']
lo del cartagena es de matones y muy barriobajero. ruben cruz y cordero van a terminar el partido sin ver la roja.... han sido mejores pero las maneras no, y el arbitro demasiado permisivo. playoff;1.0;0;0;0.0;;0;0;1;0.0;1.0;lo del cartagena es de matones y muy barriobajero. ruben cruz y cordero van a terminar el partido sin ver la roja.... han sido mejores pero las maneras no, y el arbitro demasiado permisivo. playoff;['lo', 'del', 'cartagena', 'es', 'de', 'matones', 'y', 'muy', 'barriobajero', '.', 'ruben', 'cruz', 'y', 'cordero', 'van', 'a', 'terminar', 'el', 'partido', 'sin', 'ver', 'la', 'roja', '...', '.', 'han', 'sido', 'mejores', 'pero', 'las', 'maneras', 'no', ',', 'y', 'el', 'arbitro', 'demasiado', 'permisivo', '.', 'playoff'];['cartagena', 'matones', 'barriobajero.', 'ruben', 'cruz', 'cordero', 'van', 'terminar', 'partido', 'ver', 'roja....', 'sido', 'mejores', 'maneras', 'no,', 'arbitro', 'demasiado', 'permisivo.', 'playoff']
antonio montero, en tu descripcion te falta tarado emocional barriobajero y mentecato;1.0;0;0;0.0;;0;3;1;0.0;1.0;antonio montero, en tu descripcion te falta tarado emocional barriobajero y mentecato;['antonio', 'montero', ',', 'en', 'tu', 'descripcion', 'te', 'falta', 'tarado', 'emocional', 'barriobajero', 'y', 'mentecato'];['antonio', 'montero,', 'descripcion', 'falta', 'tarado', 'emocional', 'barriobajero', 'mentecato']
ahora en el blog ❯ recetas de tartar de atun para disfrutar de platos frescos y nutritivos en verano via;0.0;0;0;0.0;;0;0;1;0.0;1.0;ahora en el blog ❯ recetas de tartar de atun para disfrutar de platos frescos y nutritivos en verano via;['ahora', 'en', 'el', 'blog', '❯', 'recetas', 'de', 'tartar', 'de', 'atun', 'para', 'disfrutar', 'de', 'platos', 'frescos', 'y', 'nutritivos', 'en', 'verano', 'via'];['ahora', 'blog', '❯', 'recetas', 'tartar', 'atun', 'disfrutar', 'platos', 'frescos', 'nutritivos', 'verano', 'via']
acabo de abrir una lata de atun con un cuchillo. ya me gradue de adulto independiente.;0.0;0;0;0.0;;0;0;0;0.0;0.0;acabo de abrir una lata de atun con un cuchillo. ya me gradue de adulto independiente.;['acabo', 'de', 'abrir', 'una', 'lata', 'de', 'atun', 'con', 'un', 'cuchillo', '.', 'ya', 'me', 'gradue', 'de', 'adulto', 'independiente', '.'];['acabo', 'abrir', 'lata', 'atun', 'cuchillo.', 'gradue', 'adulto', 'independiente.']
a alguien mas les gusta el huevo con atun?;0.0;0;0;0.0;;0;0;1;0.0;1.0;a alguien mas les gusta el huevo con atun?;['a', 'alguien', 'mas', 'les', 'gusta', 'el', 'huevo', 'con', 'atun', '?'];['alguien', 'mas', 'gusta', 'huevo', 'atun?']
domingo de ver series y comer atun... a veces duele la dieta.;0.0;0;0;0.0;;0;0;1;0.0;1.0;domingo de ver series y comer atun... a veces duele la dieta.;['domingo', 'de', 'ver', 'series', 'y', 'comer', 'atun', '...', 'a', 'veces', 'duele', 'la', 'dieta', '.'];['domingo', 'ver', 'series', 'comer', 'atun...', 'veces', 'duele', 'dieta.']
"receta de tortilla de atun y tomate 🍰 regalanos un retweet 🍧 postres dulces recetas &gt;";0.0;0;3;0.1875;🍰 🍧;2;0;1;0.375;1.1875;"receta de tortilla de atun y tomate 🍰 regalanos un retweet 🍧 postres dulces recetas &gt;";"['receta', 'de', 'tortilla', 'de', 'atun', 'y', 'tomate', '🍰', 'regalanos', 'un', 'retweet', '🍧', 'postres', 'dulces', 'recetas', '&', 'gt', ';']";"['receta', 'tortilla', 'atun', 'tomate', '🍰', 'regalanos', 'retweet', '🍧', 'postres', 'dulces', 'recetas', '&gt;']"
tendra atun, ¿no? que menos...;0.0;0;0;0.0;;0;0;0;0.0;0.0;tendra atun, ¿no? que menos...;['tendra', 'atun', ',', '¿no', '?', 'que', 'menos', '...'];['tendra', 'atun,', '¿no?', 'menos...']
macarrones al atun gratinados en el circus, paseo por el palmeral y dos horas de siesta. no querais venderme otro plan de domingo porque no lo compro.;0.0;0;4;0.14814814814814814;;0;0;1;0.0;1.1481481481481481;macarrones al atun gratinados en el circus, paseo por el palmeral y dos horas de siesta. no querais venderme otro plan de domingo porque no lo compro.;['macarrones', 'al', 'atun', 'gratinados', 'en', 'el', 'circus', ',', 'paseo', 'por', 'el', 'palmeral', 'y', 'dos', 'horas', 'de', 'siesta', '.', 'no', 'querais', 'venderme', 'otro', 'plan', 'de', 'domingo', 'porque', 'no', 'lo', 'compro', '.'];['macarrones', 'atun', 'gratinados', 'circus,', 'paseo', 'palmeral', 'dos', 'horas', 'siesta.', 'no', 'querais', 'venderme', 'plan', 'domingo', 'no', 'compro.']
la crema nivea fria en el cuerpo, los sandwiches de atun enlatado, las empanadas de cazon en la santiago mariño, parque el agua, el atardecer en juan griego... muchos recuerdos bonitos.;0.0;0;0;0.0;;0;0;1;0.0;1.0;la crema nivea fria en el cuerpo, los sandwiches de atun enlatado, las empanadas de cazon en la santiago mariño, parque el agua, el atardecer en juan griego... muchos recuerdos bonitos.;['la', 'crema', 'nivea', 'fria', 'en', 'el', 'cuerpo', ',', 'los', 'sandwiches', 'de', 'atun', 'enlatado', ',', 'las', 'empanadas', 'de', 'cazon', 'en', 'la', 'santiago', 'mariño', ',', 'parque', 'el', 'agua', ',', 'el', 'atardecer', 'en', 'juan', 'griego', '...', 'muchos', 'recuerdos', 'bonitos', '.'];['crema', 'nivea', 'fria', 'cuerpo,', 'sandwiches', 'atun', 'enlatado,', 'empanadas', 'cazon', 'santiago', 'mariño,', 'parque', 'agua,', 'atardecer', 'juan', 'griego...', 'recuerdos', 'bonitos.']
salimos de otero de guardo, un pequeño pueblo de la montaña palentina.;0.0;0;0;0.0;;0;0;0;0.0;0.0;salimos de otero de guardo, un pequeño pueblo de la montaña palentina.;['salimos', 'de', 'otero', 'de', 'guardo', ',', 'un', 'pequeño', 'pueblo', 'de', 'la', 'montaña', 'palentina', '.'];['salimos', 'otero', 'guardo,', 'pequeño', 'pueblo', 'montaña', 'palentina.']
fin de semana en bilbao, ¡y sin pisar el guggenheim! el binomio mar y montaña que rodea a la capital de vizcaya es insuperable euskadi;0.0;1;0;0.0;;0;0;1;0.0;2.0;fin de semana en bilbao, ¡y sin pisar el guggenheim! el binomio mar y montaña que rodea a la capital de vizcaya es insuperable euskadi;['fin', 'de', 'semana', 'en', 'bilbao', ',', '¡y', 'sin', 'pisar', 'el', 'guggenheim', '!', 'el', 'binomio', 'mar', 'y', 'montaña', 'que', 'rodea', 'a', 'la', 'capital', 'de', 'vizcaya', 'es', 'insuperable', 'euskadi'];['fin', 'semana', 'bilbao,', '¡y', 'pisar', 'guggenheim!', 'binomio', 'mar', 'montaña', 'rodea', 'capital', 'vizcaya', 'insuperable', 'euskadi']
felicidades enhorabuena lou lou grande maillot de la montaña y clasificacion;0.0;0;0;0.0;;0;0;1;0.0;1.0;felicidades enhorabuena lou lou grande maillot de la montaña y clasificacion;['felicidades', 'enhorabuena', 'lou', 'lou', 'grande', 'maillot', 'de', 'la', 'montaña', 'y', 'clasificacion'];['felicidades', 'enhorabuena', 'lou', 'lou', 'grande', 'maillot', 'montaña', 'clasificacion']
ascension al pico boum, valle de remuñe benasque un nuevo exito del actividad de alta montaña.;0.0;0;0;0.0;;0;0;0;0.0;0.0;ascension al pico boum, valle de remuñe benasque un nuevo exito del actividad de alta montaña.;['ascension', 'al', 'pico', 'boum', ',', 'valle', 'de', 'remuñe', 'benasque', 'un', 'nuevo', 'exito', 'del', 'actividad', 'de', 'alta', 'montaña', '.'];['ascension', 'pico', 'boum,', 'valle', 'remuñe', 'benasque', 'nuevo', 'exito', 'actividad', 'alta', 'montaña.']
si te gustan las actividades en la montaña, no te pierdas nuestro articulo en el que te decimos cuales son las mejores chaquetas para montaña con la mejor relacion calidad-precio - deportes senderismo montañismo trekking;0.0;0;0;0.0;;0;0;1;0.0;1.0;si te gustan las actividades en la montaña, no te pierdas nuestro articulo en el que te decimos cuales son las mejores chaquetas para montaña con la mejor relacion calidad-precio - deportes senderismo montañismo trekking;['si', 'te', 'gustan', 'las', 'actividades', 'en', 'la', 'montaña', ',', 'no', 'te', 'pierdas', 'nuestro', 'articulo', 'en', 'el', 'que', 'te', 'decimos', 'cuales', 'son', 'las', 'mejores', 'chaquetas', 'para', 'montaña', 'con', 'la', 'mejor', 'relacion', 'calidad-precio', '-', 'deportes', 'senderismo', 'montañismo', 'trekking'];['gustan', 'actividades', 'montaña,', 'no', 'pierdas', 'articulo', 'decimos', 'cuales', 'mejores', 'chaquetas', 'montaña', 'mejor', 'relacion', 'calidad-precio', '-', 'deportes', 'senderismo', 'montañismo', 'trekking']
de despertar en la cima de una montaña para minutos despues dejarme caer al fondo del oceao. asi va dia y el tuyo,;0.0;0;0;0.0;;0;0;1;0.0;1.0;de despertar en la cima de una montaña para minutos despues dejarme caer al fondo del oceao. asi va dia y el tuyo,;['de', 'despertar', 'en', 'la', 'cima', 'de', 'una', 'montaña', 'para', 'minutos', 'despues', 'dejarme', 'caer', 'al', 'fondo', 'del', 'oceao', '.', 'asi', 'va', 'dia', 'y', 'el', 'tuyo', ','];['despertar', 'cima', 'montaña', 'minutos', 'despues', 'dejarme', 'caer', 'fondo', 'oceao.', 'asi', 'dia', 'tuyo,']
🔵 lo que nunca debes hacer cuando conduces un coche con caja de cambios manual motor;0.0;0;0;0.0;🔵;1;0;1;0.306;1.0;🔵 lo que nunca debes hacer cuando conduces un coche con caja de cambios manual motor;['🔵', 'lo', 'que', 'nunca', 'debes', 'hacer', 'cuando', 'conduces', 'un', 'coche', 'con', 'caja', 'de', 'cambios', 'manual', 'motor'];['🔵', 'nunca', 'debes', 'hacer', 'conduces', 'coche', 'caja', 'cambios', 'manual', 'motor']
coche no se, pero hay bus cada media hora desde plaza eliptica (y se puede usar el bono transporte de madrid);0.0;0;0;0.0;;0;0;1;0.0;1.0;coche no se, pero hay bus cada media hora desde plaza eliptica (y se puede usar el bono transporte de madrid);['coche', 'no', 'se', ',', 'pero', 'hay', 'bus', 'cada', 'media', 'hora', 'desde', 'plaza', 'eliptica', '(', 'y', 'se', 'puede', 'usar', 'el', 'bono', 'transporte', 'de', 'madrid', ')'];['coche', 'no', 'se,', 'bus', 'cada', 'media', 'hora', 'plaza', 'eliptica', '(y', 'puede', 'usar', 'bono', 'transporte', 'madrid)']
money talks tesla se tira a la piscina con un coche submarino;0.0;0;0;0.0;;0;0;1;0.0;1.0;money talks tesla se tira a la piscina con un coche submarino;['money', 'talks', 'tesla', 'se', 'tira', 'a', 'la', 'piscina', 'con', 'un', 'coche', 'submarino'];['money', 'talks', 'tesla', 'tira', 'piscina', 'coche', 'submarino']
un microfono en el coche de aranda probaria el presunto acuerdo para el resultado entre el valladolid vs valencia;0.0;0;0;0.0;;0;0;1;0.0;1.0;un microfono en el coche de aranda probaria el presunto acuerdo para el resultado entre el valladolid vs valencia;['un', 'microfono', 'en', 'el', 'coche', 'de', 'aranda', 'probaria', 'el', 'presunto', 'acuerdo', 'para', 'el', 'resultado', 'entre', 'el', 'valladolid', 'vs', 'valencia'];['microfono', 'coche', 'aranda', 'probaria', 'presunto', 'acuerdo', 'resultado', 'valladolid', 'vs', 'valencia']
mañana vuelvo en coche y solo voy a hacer un examen jj;0.0;0;0;0.0;;0;0;0;0.0;0.0;mañana vuelvo en coche y solo voy a hacer un examen jj;['mañana', 'vuelvo', 'en', 'coche', 'y', 'solo', 'voy', 'a', 'hacer', 'un', 'examen', 'jj'];['mañana', 'vuelvo', 'coche', 'solo', 'voy', 'hacer', 'examen', 'jj']
necesito un coche y el carne de conducir..;0.0;0;0;0.0;;0;0;1;0.0;1.0;necesito un coche y el carne de conducir..;['necesito', 'un', 'coche', 'y', 'el', 'carne', 'de', 'conducir..'];['necesito', 'coche', 'carne', 'conducir..']
soñe que me robaban el coche 😓;0.0;0;0;0.0;😓;1;0;0;-0.20800000000000002;0.0;soñe que me robaban el coche 😓;['soñe', 'que', 'me', 'robaban', 'el', 'coche', '😓'];['soñe', 'robaban', 'coche', '😓']
ayer aguante como una campeona sin beber nada d alcohol porq iba con el coche, ahora puedo con todo lo q se me ponga por dlante;0.0;0;0;0.0;;0;0;0;0.0;0.0;ayer aguante como una campeona sin beber nada d alcohol porq iba con el coche, ahora puedo con todo lo q se me ponga por dlante;['ayer', 'aguante', 'como', 'una', 'campeona', 'sin', 'beber', 'nada', 'd', 'alcohol', 'porq', 'iba', 'con', 'el', 'coche', ',', 'ahora', 'puedo', 'con', 'todo', 'lo', 'q', 'se', 'me', 'ponga', 'por', 'dlante'];['ayer', 'aguante', 'campeona', 'beber', 'd', 'alcohol', 'porq', 'iba', 'coche,', 'ahora', 'puedo', 'q', 'ponga', 'dlante']
en el coche del tio para la tierra a trabajar;0.0;0;0;0.0;;0;0;0;0.0;0.0;en el coche del tio para la tierra a trabajar;['en', 'el', 'coche', 'del', 'tio', 'para', 'la', 'tierra', 'a', 'trabajar'];['coche', 'tio', 'tierra', 'trabajar']
una hora y minutos esperando un autobus, como te echo de menos coche 😭;0.0;0;0;0.0;😭;1;0;1;-0.09300000000000001;1.0;una hora y minutos esperando un autobus, como te echo de menos coche 😭;['una', 'hora', 'y', 'minutos', 'esperando', 'un', 'autobus', ',', 'como', 'te', 'echo', 'de', 'menos', 'coche', '😭'];['hora', 'minutos', 'esperando', 'autobus,', 'echo', 'menos', 'coche', '😭']
¡echa un vistazo a mi transmision desde mi playstation ! ps4live (gran turismo™sport) live at;0.0;1;1;0.06666666666666667;™;1;0;1;0.0;2.0666666666666664;¡echa un vistazo a mi transmision desde mi playstation ! ps4live (gran turismo™sport) live at;['¡echa', 'un', 'vistazo', 'a', 'mi', 'transmision', 'desde', 'mi', 'playstation', '!', 'ps4live', '(', 'gran', 'turismo™sport', ')', 'live', 'at'];['¡echa', 'vistazo', 'transmision', 'playstation', '!', 'ps4live', '(gran', 'turismo™sport)', 'live', 'at']
buena transmision;0.0;0;0;0.0;;0;0;0;0.0;0.0;buena transmision;['buena', 'transmision'];['buena', 'transmision']
y la transmision?;0.0;0;0;0.0;;0;0;0;0.0;0.0;y la transmision?;['y', 'la', 'transmision', '?'];['transmision?']
nos dañaron el domingo a los q ibamos a ver la transmision por youtube 😪;0.0;0;0;0.0;😪;1;0;0;-0.08;0.0;nos dañaron el domingo a los q ibamos a ver la transmision por youtube 😪;['nos', 'dañaron', 'el', 'domingo', 'a', 'los', 'q', 'ibamos', 'a', 'ver', 'la', 'transmision', 'por', 'youtube', '😪'];['dañaron', 'domingo', 'q', 'ibamos', 'ver', 'transmision', 'youtube', '😪']
roberto gonzalez candidato a la muni capitalina por creo llega a votar a z11. transmision de radio sonora. . el deseo por servir se mantiene y para una nueva era en la municipalidad.;0.0;0;3;0.09090909090909091;;0;0;1;0.0;1.0909090909090908;roberto gonzalez candidato a la muni capitalina por creo llega a votar a z11. transmision de radio sonora. . el deseo por servir se mantiene y para una nueva era en la municipalidad.;['roberto', 'gonzalez', 'candidato', 'a', 'la', 'muni', 'capitalina', 'por', 'creo', 'llega', 'a', 'votar', 'a', 'z11', '.', 'transmision', 'de', 'radio', 'sonora', '.', '.', 'el', 'deseo', 'por', 'servir', 'se', 'mantiene', 'y', 'para', 'una', 'nueva', 'era', 'en', 'la', 'municipalidad', '.'];['roberto', 'gonzalez', 'candidato', 'muni', 'capitalina', 'creo', 'llega', 'votar', 'z11.', 'transmision', 'radio', 'sonora.', '.', 'deseo', 'servir', 'mantiene', 'nueva', 'municipalidad.']
¡echa un vistazo a mi transmision de (fortnite) live at;0.0;0;0;0.0;;0;0;0;0.0;0.0;¡echa un vistazo a mi transmision de (fortnite) live at;['¡echa', 'un', 'vistazo', 'a', 'mi', 'transmision', 'de', '(', 'fortnite', ')', 'live', 'at'];['¡echa', 'vistazo', 'transmision', '(fortnite)', 'live', 'at']
las infecciones de transmision sexual mas frecuentes salud;0.0;0;0;0.0;;0;0;1;0.0;1.0;las infecciones de transmision sexual mas frecuentes salud;['las', 'infecciones', 'de', 'transmision', 'sexual', 'mas', 'frecuentes', 'salud'];['infecciones', 'transmision', 'sexual', 'mas', 'frecuentes', 'salud']
le ruego que no me tutee. respecto al como siempre, no se donde hizo ud la selectividad, pero en algunas ccaa ponen textos no argumentativos. literarios, por ejemplo. y no siempre se pide la opinion. ah, y mis opiniones tendran *sesgo*, pero yo no pongo las pruebas de la ebau.;0.0;0;2;0.04;;0;0;1;0.0;1.04;le ruego que no me tutee. respecto al como siempre, no se donde hizo ud la selectividad, pero en algunas ccaa ponen textos no argumentativos. literarios, por ejemplo. y no siempre se pide la opinion. ah, y mis opiniones tendran *sesgo*, pero yo no pongo las pruebas de la ebau.;['le', 'ruego', 'que', 'no', 'me', 'tutee', '.', 'respecto', 'al', 'como', 'siempre', ',', 'no', 'se', 'donde', 'hizo', 'ud', 'la', 'selectividad', ',', 'pero', 'en', 'algunas', 'ccaa', 'ponen', 'textos', 'no', 'argumentativos', '.', 'literarios', ',', 'por', 'ejemplo', '.', 'y', 'no', 'siempre', 'se', 'pide', 'la', 'opinion', '.', 'ah', ',', 'y', 'mis', 'opiniones', 'tendran', '*sesgo*', ',', 'pero', 'yo', 'no', 'pongo', 'las', 'pruebas', 'de', 'la', 'ebau', '.'];['ruego', 'no', 'tutee.', 'respecto', 'siempre,', 'no', 'hizo', 'ud', 'selectividad,', 'ccaa', 'ponen', 'textos', 'no', 'argumentativos.', 'literarios,', 'ejemplo.', 'no', 'siempre', 'pide', 'opinion.', 'ah,', 'opiniones', 'tendran', '*sesgo*,', 'no', 'pongo', 'pruebas', 'ebau.']
entregaran .000 firmas por una selectividad unica en toda españa;0.0;0;0;0.0;;0;0;0;0.0;0.0;entregaran .000 firmas por una selectividad unica en toda españa;['entregaran', '.000', 'firmas', 'por', 'una', 'selectividad', 'unica', 'en', 'toda', 'españa'];['entregaran', '.000', 'firmas', 'selectividad', 'unica', 'toda', 'españa']
una niña que acaba de hacer selectividad me ha preguntado sobre farmacia , chicos que le digo ?;0.0;0;0;0.0;;0;0;0;0.0;0.0;una niña que acaba de hacer selectividad me ha preguntado sobre farmacia , chicos que le digo ?;['una', 'niña', 'que', 'acaba', 'de', 'hacer', 'selectividad', 'me', 'ha', 'preguntado', 'sobre', 'farmacia', ',', 'chicos', 'que', 'le', 'digo', '?'];['niña', 'acaba', 'hacer', 'selectividad', 'preguntado', 'farmacia', ',', 'chicos', 'digo', '?']
la selectividad ha dejado la nota media mas baja de los ultimos años. desde los estudiantes no promediaban una puntuacion menor. en concreto ha sido de un ,27, lo que supone decimas peor que el año pasado.;0.0;0;0;0.0;;0;0;1;0.0;1.0;la selectividad ha dejado la nota media mas baja de los ultimos años. desde los estudiantes no promediaban una puntuacion menor. en concreto ha sido de un ,27, lo que supone decimas peor que el año pasado.;['la', 'selectividad', 'ha', 'dejado', 'la', 'nota', 'media', 'mas', 'baja', 'de', 'los', 'ultimos', 'años', '.', 'desde', 'los', 'estudiantes', 'no', 'promediaban', 'una', 'puntuacion', 'menor', '.', 'en', 'concreto', 'ha', 'sido', 'de', 'un', ',27', ',', 'lo', 'que', 'supone', 'decimas', 'peor', 'que', 'el', 'año', 'pasado', '.'];['selectividad', 'dejado', 'nota', 'media', 'mas', 'baja', 'ultimos', 'años.', 'estudiantes', 'no', 'promediaban', 'puntuacion', 'menor.', 'concreto', 'sido', ',27,', 'supone', 'decimas', 'peor', 'año', 'pasado.']
selectividad del . historia del arte. describa este cuadro.;0.0;0;0;0.0;;0;0;1;0.0;1.0;selectividad del . historia del arte. describa este cuadro.;['selectividad', 'del', '.', 'historia', 'del', 'arte', '.', 'describa', 'este', 'cuadro', '.'];['selectividad', '.', 'historia', 'arte.', 'describa', 'cuadro.']
