texto;toxico;num_admir;num_may;num_may_esc;emojis;num_emoji;num_insultos;dir_23ps;score_emoji_tox;emphasize;series_token2;series_token;filtered_words
finde de ⛰ 🌳 . . . . . . . . . . . . nonfilters sierrademaria losvelez andalucia senderismo hiking friends traveling en parque natural de maria los velez;0.0;0;0;0.0;⛰ 🌳;2;0;0;0.0;0.0;finde de ⛰ 🌳 . . . . . . . . . . . . nonfilters sierrademaria losvelez andalucia senderismo hiking friends traveling en parque natural de maria los velez;['finde', 'de', '⛰', '🌳', '.', '.', '.', '.', '.', '.', '.', '.', '.', '.', '.', '.', 'nonfilters', 'sierrademaria', 'losvelez', 'andalucia', 'senderismo', 'hiking', 'friends', 'traveling', 'en', 'parque', 'natural', 'de', 'maria', 'los', 'velez'];['finde', '⛰', '🌳', '.', '.', '.', '.', '.', '.', '.', '.', '.', '.', '.', '.', 'nonfilters', 'sierrademaria', 'losvelez', 'andalucia', 'senderismo', 'hiking', 'friends', 'traveling', 'parque', 'natural', 'maria', 'velez']
benditas excursiones de biologia ft senderismo;0.0;0;0;0.0;;0;0;1;0.0;1.0;benditas excursiones de biologia ft senderismo;['benditas', 'excursiones', 'de', 'biologia', 'ft', 'senderismo'];['benditas', 'excursiones', 'biologia', 'ft', 'senderismo']
senderismo universidad popular de albacete. hasta el curso que viene. felices vacaciones!;0.0;1;0;0.0;;0;0;1;0.0;2.0;senderismo universidad popular de albacete. hasta el curso que viene. felices vacaciones!;['senderismo', 'universidad', 'popular', 'de', 'albacete', '.', 'hasta', 'el', 'curso', 'que', 'viene', '.', 'felices', 'vacaciones', '!'];['senderismo', 'universidad', 'popular', 'albacete.', 'curso', 'viene.', 'felices', 'vacaciones!']
imagenes de la ruta del dia /06/19, de senderismo por la sierradeguara huesca canariasclimb yosoydecanariasclimb en sierra de guara;0.0;0;0;0.0;;0;0;1;0.0;1.0;imagenes de la ruta del dia /06/19, de senderismo por la sierradeguara huesca canariasclimb yosoydecanariasclimb en sierra de guara;['imagenes', 'de', 'la', 'ruta', 'del', 'dia', '/06/19', ',', 'de', 'senderismo', 'por', 'la', 'sierradeguara', 'huesca', 'canariasclimb', 'yosoydecanariasclimb', 'en', 'sierra', 'de', 'guara'];['imagenes', 'ruta', 'dia', '/06/19,', 'senderismo', 'sierradeguara', 'huesca', 'canariasclimb', 'yosoydecanariasclimb', 'sierra', 'guara']
7 rutas de senderismo en castellon provincia;0.0;0;0;0.0;;0;0;0;0.0;0.0;7 rutas de senderismo en castellon provincia;['7', 'rutas', 'de', 'senderismo', 'en', 'castellon', 'provincia'];['7', 'rutas', 'senderismo', 'castellon', 'provincia']
"yoga &amp; senderismo en picos de europa";0.0;0;6;0.8571428571428571;;0;0;0;0.0;0.8571428571428571;"yoga &amp; senderismo en picos de europa";"['yoga', '&', 'amp', ';', 'senderismo', 'en', 'picos', 'de', 'europa']";"['yoga', '&amp;', 'senderismo', 'picos', 'europa']"
"tan efimera la vida,tan corta hoy ire a el avila un poquito de senderismo no hace nada mal. los hierbajos de hace poco han renacido y se les nota el verde en las muy pequeñas hojas;el agua del riachuelo corre con mas fuerza;los pajaros andan porai(vienen a mi casa a cada rato)";0.0;0;0;0.0;;0;0;1;0.0;1.0;"tan efimera la vida,tan corta hoy ire a el avila un poquito de senderismo no hace nada mal. los hierbajos de hace poco han renacido y se les nota el verde en las muy pequeñas hojas;el agua del riachuelo corre con mas fuerza;los pajaros andan porai(vienen a mi casa a cada rato)";"['tan', 'efimera', 'la', 'vida', ',', 'tan', 'corta', 'hoy', 'ire', 'a', 'el', 'avila', 'un', 'poquito', 'de', 'senderismo', 'no', 'hace', 'nada', 'mal', '.', 'los', 'hierbajos', 'de', 'hace', 'poco', 'han', 'renacido', 'y', 'se', 'les', 'nota', 'el', 'verde', 'en', 'las', 'muy', 'pequeñas', 'hojas', ';', 'el', 'agua', 'del', 'riachuelo', 'corre', 'con', 'mas', 'fuerza', ';', 'los', 'pajaros', 'andan', 'porai', '(', 'vienen', 'a', 'mi', 'casa', 'a', 'cada', 'rato', ')']";"['tan', 'efimera', 'vida,tan', 'corta', 'hoy', 'ire', 'avila', 'poquito', 'senderismo', 'no', 'hace', 'mal.', 'hierbajos', 'hace', 'renacido', 'nota', 'verde', 'pequeñas', 'hojas;el', 'agua', 'riachuelo', 'corre', 'mas', 'fuerza;los', 'pajaros', 'andan', 'porai(vienen', 'casa', 'cada', 'rato)']"
¿preparad@ para la marcha senderista nocturna bandolera? 🌌 🚶‍ ♀️ 🚶 ‍♂️ 🏁 el proximo de julio salida desde gambrinus a las :00 horas con un recorrido de kms. mas info: amontillate montilla deporte senderismo;0.0;0;0;0.0;🌌 🚶 ♀ 🚶 ♂ 🏁;6;0;1;0.0;1.0;¿preparad@ para la marcha senderista nocturna bandolera? 🌌 🚶‍ ♀️ 🚶 ‍♂️ 🏁 el proximo de julio salida desde gambrinus a las :00 horas con un recorrido de kms. mas info: amontillate montilla deporte senderismo;['¿preparad', '@', 'para', 'la', 'marcha', 'senderista', 'nocturna', 'bandolera', '?', '🌌', '🚶\u200d', '♀️', '🚶', '\u200d♂️', '🏁', 'el', 'proximo', 'de', 'julio', 'salida', 'desde', 'gambrinus', 'a', 'las', ':00', 'horas', 'con', 'un', 'recorrido', 'de', 'kms', '.', 'mas', 'info', ':', 'amontillate', 'montilla', 'deporte', 'senderismo'];['¿preparad@', 'marcha', 'senderista', 'nocturna', 'bandolera?', '🌌', '🚶\u200d', '♀️', '🚶', '\u200d♂️', '🏁', 'proximo', 'julio', 'salida', 'gambrinus', ':00', 'horas', 'recorrido', 'kms.', 'mas', 'info:', 'amontillate', 'montilla', 'deporte', 'senderismo']
soñe que aprobaba los mt en natacion .. por favor que asi sea 😭;0.0;0;0;0.0;😭;1;0;0;-0.09300000000000001;0.0;soñe que aprobaba los mt en natacion .. por favor que asi sea 😭;['soñe', 'que', 'aprobaba', 'los', 'mt', 'en', 'natacion', '..', 'por', 'favor', 'que', 'asi', 'sea', '😭'];['soñe', 'aprobaba', 'mt', 'natacion', '..', 'favor', 'asi', '😭']
natacion dos australianos vencen al estrecho de gibraltar;0.0;0;0;0.0;;0;0;0;0.0;0.0;natacion dos australianos vencen al estrecho de gibraltar;['natacion', 'dos', 'australianos', 'vencen', 'al', 'estrecho', 'de', 'gibraltar'];['natacion', 'dos', 'australianos', 'vencen', 'estrecho', 'gibraltar']
cuando tu cole no tiene piscina y tienes que hacer natacion sincronizada...;0.0;0;0;0.0;;0;0;1;0.0;1.0;cuando tu cole no tiene piscina y tienes que hacer natacion sincronizada...;['cuando', 'tu', 'cole', 'no', 'tiene', 'piscina', 'y', 'tienes', 'que', 'hacer', 'natacion', 'sincronizada', '...'];['cole', 'no', 'piscina', 'hacer', 'natacion', 'sincronizada...']
gracias por vuestra visita, volved pronto! y buen viaje amigos. enhorabuena natacion trofeorcndelfin;0.0;1;0;0.0;;0;0;1;0.0;2.0;gracias por vuestra visita, volved pronto! y buen viaje amigos. enhorabuena natacion trofeorcndelfin;['gracias', 'por', 'vuestra', 'visita', ',', 'volved', 'pronto', '!', 'y', 'buen', 'viaje', 'amigos', '.', 'enhorabuena', 'natacion', 'trofeorcndelfin'];['gracias', 'visita,', 'volved', 'pronto!', 'buen', 'viaje', 'amigos.', 'enhorabuena', 'natacion', 'trofeorcndelfin']
la natacion, un estilo de vida;0.0;0;0;0.0;;0;0;1;0.0;1.0;la natacion, un estilo de vida;['la', 'natacion', ',', 'un', 'estilo', 'de', 'vida'];['natacion,', 'estilo', 'vida']
gracias carmena por cargarte los clubs de natacion de madrid;0.0;0;0;0.0;;0;0;0;0.0;0.0;gracias carmena por cargarte los clubs de natacion de madrid;['gracias', 'carmena', 'por', 'cargarte', 'los', 'clubs', 'de', 'natacion', 'de', 'madrid'];['gracias', 'carmena', 'cargarte', 'clubs', 'natacion', 'madrid']
me sentaria enseñar natacion en colegios que cubren necesidades especiales;0.0;0;0;0.0;;0;0;1;0.0;1.0;me sentaria enseñar natacion en colegios que cubren necesidades especiales;['me', 'sentaria', 'enseñar', 'natacion', 'en', 'colegios', 'que', 'cubren', 'necesidades', 'especiales'];['sentaria', 'enseñar', 'natacion', 'colegios', 'cubren', 'necesidades', 'especiales']
natacion en piscina olimpica. 👌 👏 🏊 ‍♂️;0.0;0;0;0.0;👌 👏 🏊 ♂;4;0;0;0.44575;0.0;natacion en piscina olimpica. 👌 👏 🏊 ‍♂️;['natacion', 'en', 'piscina', 'olimpica', '.', '👌', '👏', '🏊', '\u200d♂️'];['natacion', 'piscina', 'olimpica.', '👌', '👏', '🏊', '\u200d♂️']
nuestro equipo de sincronizada en el campeonato de madrid. natacion sincro villaviciosadeodon;0.0;0;0;0.0;;0;0;1;0.0;1.0;nuestro equipo de sincronizada en el campeonato de madrid. natacion sincro villaviciosadeodon;['nuestro', 'equipo', 'de', 'sincronizada', 'en', 'el', 'campeonato', 'de', 'madrid', '.', 'natacion', 'sincro', 'villaviciosadeodon'];['equipo', 'sincronizada', 'campeonato', 'madrid.', 'natacion', 'sincro', 'villaviciosadeodon']
muchas felicidades al son campeones de españa de natacion adaptada 🏊‍ ♀️ 🏊‍♂️ mataro maresme catalunya natacion;0.0;0;0;0.0;🏊 ♀ 🏊 ♂;4;0;1;0.0;1.0;muchas felicidades al son campeones de españa de natacion adaptada 🏊‍ ♀️ 🏊‍♂️ mataro maresme catalunya natacion;['muchas', 'felicidades', 'al', 'son', 'campeones', 'de', 'españa', 'de', 'natacion', 'adaptada', '🏊\u200d', '♀️', '🏊\u200d♂️', 'mataro', 'maresme', 'catalunya', 'natacion'];['muchas', 'felicidades', 'campeones', 'españa', 'natacion', 'adaptada', '🏊\u200d', '♀️', '🏊\u200d♂️', 'mataro', 'maresme', 'catalunya', 'natacion']
no hay tiempo para estar triste;0.0;0;0;0.0;;0;0;1;0.0;1.0;no hay tiempo para estar triste;['no', 'hay', 'tiempo', 'para', 'estar', 'triste'];['no', 'tiempo', 'triste']
jugamos con uno menos el primer tiempo;0.0;0;0;0.0;;0;0;0;0.0;0.0;jugamos con uno menos el primer tiempo;['jugamos', 'con', 'uno', 'menos', 'el', 'primer', 'tiempo'];['jugamos', 'menos', 'primer', 'tiempo']
porque todos tus tweets son tan tristes ?:(;0.0;0;0;0.0;;0;0;1;0.0;1.0;porque todos tus tweets son tan tristes ?:(;['porque', 'todos', 'tus', 'tweets', 'son', 'tan', 'tristes', '?', ':', '('];['tweets', 'tan', 'tristes', '?:(']
¿que tan similares son nuestros gustos ?;0.0;0;0;0.0;;0;0;1;0.0;1.0;¿que tan similares son nuestros gustos ?;['¿que', 'tan', 'similares', 'son', 'nuestros', 'gustos', '?'];['¿que', 'tan', 'similares', 'gustos', '?']
increible como logras tener mi atencion tan facil;0.0;0;0;0.0;;0;0;0;0.0;0.0;increible como logras tener mi atencion tan facil;['increible', 'como', 'logras', 'tener', 'mi', 'atencion', 'tan', 'facil'];['increible', 'logras', 'tener', 'atencion', 'tan', 'facil']
acomode tan mal mis almohadas anoche que hoy me desperte con alto dolor de espalda;0.0;0;0;0.0;;0;0;1;0.0;1.0;acomode tan mal mis almohadas anoche que hoy me desperte con alto dolor de espalda;['acomode', 'tan', 'mal', 'mis', 'almohadas', 'anoche', 'que', 'hoy', 'me', 'desperte', 'con', 'alto', 'dolor', 'de', 'espalda'];['acomode', 'tan', 'mal', 'almohadas', 'anoche', 'hoy', 'desperte', 'alto', 'dolor', 'espalda']
nunk dormi tan mal como anoche;0.0;0;0;0.0;;0;0;0;0.0;0.0;nunk dormi tan mal como anoche;['nunk', 'dormi', 'tan', 'mal', 'como', 'anoche'];['nunk', 'dormi', 'tan', 'mal', 'anoche']
nunca me habia sentido tan sola como hoy;0.0;0;0;0.0;;0;0;0;0.0;0.0;nunca me habia sentido tan sola como hoy;['nunca', 'me', 'habia', 'sentido', 'tan', 'sola', 'como', 'hoy'];['nunca', 'habia', 'tan', 'sola', 'hoy']
por el amor de dios necesito ese anillo de pandora, no puede ser tan tan hermoso;0.0;0;0;0.0;;0;0;1;0.0;1.0;por el amor de dios necesito ese anillo de pandora, no puede ser tan tan hermoso;['por', 'el', 'amor', 'de', 'dios', 'necesito', 'ese', 'anillo', 'de', 'pandora', ',', 'no', 'puede', 'ser', 'tan', 'tan', 'hermoso'];['amor', 'dios', 'necesito', 'anillo', 'pandora,', 'no', 'puede', 'ser', 'tan', 'tan', 'hermoso']
que nos perdone nuestra nacion por tener un gobierno tan ignorante.;0.0;0;0;0.0;;0;0;1;0.0;1.0;que nos perdone nuestra nacion por tener un gobierno tan ignorante.;['que', 'nos', 'perdone', 'nuestra', 'nacion', 'por', 'tener', 'un', 'gobierno', 'tan', 'ignorante', '.'];['perdone', 'nacion', 'tener', 'gobierno', 'tan', 'ignorante.']
day : grandisimo imbecil;1.0;0;0;0.0;;0;1;0;0.0;0.0;day : grandisimo imbecil;['day', ':', 'grandisimo', 'imbecil'];['day', ':', 'grandisimo', 'imbecil']
aplausos, señor abreu. como el grandisimo gustavo bueno, pero mas expeditivo.;0.0;0;0;0.0;;0;0;0;0.0;0.0;aplausos, señor abreu. como el grandisimo gustavo bueno, pero mas expeditivo.;['aplausos', ',', 'señor', 'abreu', '.', 'como', 'el', 'grandisimo', 'gustavo', 'bueno', ',', 'pero', 'mas', 'expeditivo', '.'];['aplausos,', 'señor', 'abreu.', 'grandisimo', 'gustavo', 'bueno,', 'mas', 'expeditivo.']
el guionista de ese capitulo se merecia todos los premios posibles. grandisimo! (y muy triste);0.0;1;0;0.0;;0;0;1;0.0;2.0;el guionista de ese capitulo se merecia todos los premios posibles. grandisimo! (y muy triste);['el', 'guionista', 'de', 'ese', 'capitulo', 'se', 'merecia', 'todos', 'los', 'premios', 'posibles', '.', 'grandisimo', '!', '(', 'y', 'muy', 'triste', ')'];['guionista', 'capitulo', 'merecia', 'premios', 'posibles.', 'grandisimo!', '(y', 'triste)']
el barca no va a transferir a dembele y bien hecho porque es un grandisimo jugador;0.0;0;0;0.0;;0;0;1;0.0;1.0;el barca no va a transferir a dembele y bien hecho porque es un grandisimo jugador;['el', 'barca', 'no', 'va', 'a', 'transferir', 'a', 'dembele', 'y', 'bien', 'hecho', 'porque', 'es', 'un', 'grandisimo', 'jugador'];['barca', 'no', 'transferir', 'dembele', 'hecho', 'grandisimo', 'jugador']
casemiro sobre james: seria muy importante para nosotros que regrese al real madrid. ya demostro a todo el mundo que es un gran jugador. tengo un cariño grandisimo por el, como jugador y como persona. seguro si regresa al real madrid sera bienvenido por todas sus cualidades.;0.0;0;0;0.0;;0;0;1;0.0;1.0;casemiro sobre james: seria muy importante para nosotros que regrese al real madrid. ya demostro a todo el mundo que es un gran jugador. tengo un cariño grandisimo por el, como jugador y como persona. seguro si regresa al real madrid sera bienvenido por todas sus cualidades.;['casemiro', 'sobre', 'james', ':', 'seria', 'muy', 'importante', 'para', 'nosotros', 'que', 'regrese', 'al', 'real', 'madrid', '.', 'ya', 'demostro', 'a', 'todo', 'el', 'mundo', 'que', 'es', 'un', 'gran', 'jugador', '.', 'tengo', 'un', 'cariño', 'grandisimo', 'por', 'el', ',', 'como', 'jugador', 'y', 'como', 'persona', '.', 'seguro', 'si', 'regresa', 'al', 'real', 'madrid', 'sera', 'bienvenido', 'por', 'todas', 'sus', 'cualidades', '.'];['casemiro', 'james:', 'seria', 'importante', 'regrese', 'real', 'madrid.', 'demostro', 'mundo', 'gran', 'jugador.', 'cariño', 'grandisimo', 'el,', 'jugador', 'persona.', 'seguro', 'regresa', 'real', 'madrid', 'sera', 'bienvenido', 'todas', 'cualidades.']
es un grandisimo hijo de puta. la vida te cobrara todo esto, malnacido de mierda;1.0;0;0;0.0;;0;0;1;0.0;1.0;es un grandisimo hijo de puta. la vida te cobrara todo esto, malnacido de mierda;['es', 'un', 'grandisimo', 'hijo', 'de', 'puta', '.', 'la', 'vida', 'te', 'cobrara', 'todo', 'esto', ',', 'malnacido', 'de', 'mierda'];['grandisimo', 'hijo', 'puta.', 'vida', 'cobrara', 'esto,', 'malnacido', 'mierda']
grandisimo fichaje.;0.0;0;0;0.0;;0;0;0;0.0;0.0;grandisimo fichaje.;['grandisimo', 'fichaje', '.'];['grandisimo', 'fichaje.']
es un bicho si, pero años o casi. mucha pasta. pero grandisimo central;0.0;0;0;0.0;;0;0;0;0.0;0.0;es un bicho si, pero años o casi. mucha pasta. pero grandisimo central;['es', 'un', 'bicho', 'si', ',', 'pero', 'años', 'o', 'casi', '.', 'mucha', 'pasta', '.', 'pero', 'grandisimo', 'central'];['bicho', 'si,', 'años', 'casi.', 'mucha', 'pasta.', 'grandisimo', 'central']
este de los tirantes no vale ni para payaso..con admiracion para los grandes payasos.este es un grandisimo chufla.;1.0;0;0;0.0;;0;0;1;0.0;1.0;este de los tirantes no vale ni para payaso..con admiracion para los grandes payasos.este es un grandisimo chufla.;['este', 'de', 'los', 'tirantes', 'no', 'vale', 'ni', 'para', 'payaso..con', 'admiracion', 'para', 'los', 'grandes', 'payasos.este', 'es', 'un', 'grandisimo', 'chufla', '.'];['tirantes', 'no', 'vale', 'payaso..con', 'admiracion', 'grandes', 'payasos.este', 'grandisimo', 'chufla.']
hazle un favor al barca y vete a la mierda, grandisimo hijoputa. eres el cancer del barca.;1.0;0;2;0.11764705882352941;;0;0;1;0.0;1.1176470588235294;hazle un favor al barca y vete a la mierda, grandisimo hijoputa. eres el cancer del barca.;['hazle', 'un', 'favor', 'al', 'barca', 'y', 'vete', 'a', 'la', 'mierda', ',', 'grandisimo', 'hijoputa', '.', 'eres', 'el', 'cancer', 'del', 'barca', '.'];['hazle', 'favor', 'barca', 'vete', 'mierda,', 'grandisimo', 'hijoputa.', 'cancer', 'barca.']
felicidades. ha sido un grandisimo torneo si señor;0.0;0;0;0.0;;0;0;1;0.0;1.0;felicidades. ha sido un grandisimo torneo si señor;['felicidades', '.', 'ha', 'sido', 'un', 'grandisimo', 'torneo', 'si', 'señor'];['felicidades.', 'sido', 'grandisimo', 'torneo', 'señor']
pedrerol no se puede ser mas hipocrita;0.0;0;1;0.14285714285714285;;0;0;0;0.0;0.14285714285714285;pedrerol no se puede ser mas hipocrita;['pedrerol', 'no', 'se', 'puede', 'ser', 'mas', 'hipocrita'];['pedrerol', 'no', 'puede', 'ser', 'mas', 'hipocrita']
no se puede ser mas inhumana,ud,ha leido el informe de la onu,amnistia inter.amnistia es,pen etc.porque no habla de los privilegips del cuñado del rey?;0.0;0;1;0.041666666666666664;;0;0;1;0.0;1.0416666666666667;no se puede ser mas inhumana,ud,ha leido el informe de la onu,amnistia inter.amnistia es,pen etc.porque no habla de los privilegips del cuñado del rey?;['no', 'se', 'puede', 'ser', 'mas', 'inhumana', ',', 'ud', ',', 'ha', 'leido', 'el', 'informe', 'de', 'la', 'onu', ',', 'amnistia', 'inter.amnistia', 'es', ',', 'pen', 'etc.porque', 'no', 'habla', 'de', 'los', 'privilegips', 'del', 'cuñado', 'del', 'rey', '?'];['no', 'puede', 'ser', 'mas', 'inhumana,ud,ha', 'leido', 'informe', 'onu,amnistia', 'inter.amnistia', 'es,pen', 'etc.porque', 'no', 'habla', 'privilegips', 'cuñado', 'rey?']
mejor yo diria que no se puede ser mas apatrida quitando la luz todos los dias a toda hora;0.0;0;0;0.0;;0;0;0;0.0;0.0;mejor yo diria que no se puede ser mas apatrida quitando la luz todos los dias a toda hora;['mejor', 'yo', 'diria', 'que', 'no', 'se', 'puede', 'ser', 'mas', 'apatrida', 'quitando', 'la', 'luz', 'todos', 'los', 'dias', 'a', 'toda', 'hora'];['mejor', 'diria', 'no', 'puede', 'ser', 'mas', 'apatrida', 'quitando', 'luz', 'dias', 'toda', 'hora']
no se puede ser mas bueno que adri;0.0;0;0;0.0;;0;0;0;0.0;0.0;no se puede ser mas bueno que adri;['no', 'se', 'puede', 'ser', 'mas', 'bueno', 'que', 'adri'];['no', 'puede', 'ser', 'mas', 'bueno', 'adri']
no se puede ser mas inutil que yo;1.0;0;0;0.0;;0;0;0;0.0;0.0;no se puede ser mas inutil que yo;['no', 'se', 'puede', 'ser', 'mas', 'inutil', 'que', 'yo'];['no', 'puede', 'ser', 'mas', 'inutil']
no se puede ser mas imbecil.;1.0;0;0;0.0;;0;0;0;0.0;0.0;no se puede ser mas imbecil.;['no', 'se', 'puede', 'ser', 'mas', 'imbecil', '.'];['no', 'puede', 'ser', 'mas', 'imbecil.']
no se puede ser mas mierda ok;1.0;0;0;0.0;;0;0;0;0.0;0.0;no se puede ser mas mierda ok;['no', 'se', 'puede', 'ser', 'mas', 'mierda', 'ok'];['no', 'puede', 'ser', 'mas', 'mierda', 'ok']
no se puede ser mas desagradable;0.0;0;0;0.0;;0;0;1;0.0;1.0;no se puede ser mas desagradable;['no', 'se', 'puede', 'ser', 'mas', 'desagradable'];['no', 'puede', 'ser', 'mas', 'desagradable']
jugando draven y vayne no se puede ser mas guarro;1.0;0;0;0.0;;0;0;0;0.0;0.0;jugando draven y vayne no se puede ser mas guarro;['jugando', 'draven', 'y', 'vayne', 'no', 'se', 'puede', 'ser', 'mas', 'guarro'];['jugando', 'draven', 'vayne', 'no', 'puede', 'ser', 'mas', 'guarro']
no se puede ser mas inutil que esta directiva, se hace tt valverdeout y publican que la mayoria fuimos bots franceses, de verdad creian que iban a acallar las criticas con eso? pues aqui otro que utilizo ese hashtag sin ser un bot frances, id buscando otra excusa. botdecensura;1.0;0;2;0.04081632653061224;;0;0;1;0.0;1.0408163265306123;no se puede ser mas inutil que esta directiva, se hace tt valverdeout y publican que la mayoria fuimos bots franceses, de verdad creian que iban a acallar las criticas con eso? pues aqui otro que utilizo ese hashtag sin ser un bot frances, id buscando otra excusa. botdecensura;['no', 'se', 'puede', 'ser', 'mas', 'inutil', 'que', 'esta', 'directiva', ',', 'se', 'hace', 'tt', 'valverdeout', 'y', 'publican', 'que', 'la', 'mayoria', 'fuimos', 'bots', 'franceses', ',', 'de', 'verdad', 'creian', 'que', 'iban', 'a', 'acallar', 'las', 'criticas', 'con', 'eso', '?', 'pues', 'aqui', 'otro', 'que', 'utilizo', 'ese', 'hashtag', 'sin', 'ser', 'un', 'bot', 'frances', ',', 'id', 'buscando', 'otra', 'excusa', '.', 'botdecensura'];['no', 'puede', 'ser', 'mas', 'inutil', 'directiva,', 'hace', 'tt', 'valverdeout', 'publican', 'mayoria', 'bots', 'franceses,', 'verdad', 'creian', 'iban', 'acallar', 'criticas', 'eso?', 'pues', 'aqui', 'utilizo', 'hashtag', 'ser', 'bot', 'frances,', 'id', 'buscando', 'excusa.', 'botdecensura']
respeta al rey y largate a tu casa como dijiste, ya han pasado meses y podras dedicar tu tiempo a hacer muchos lacitos amarillos. no se puede ser mas ignorante.;1.0;0;0;0.0;;0;0;1;0.0;1.0;respeta al rey y largate a tu casa como dijiste, ya han pasado meses y podras dedicar tu tiempo a hacer muchos lacitos amarillos. no se puede ser mas ignorante.;['respeta', 'al', 'rey', 'y', 'largate', 'a', 'tu', 'casa', 'como', 'dijiste', ',', 'ya', 'han', 'pasado', 'meses', 'y', 'podras', 'dedicar', 'tu', 'tiempo', 'a', 'hacer', 'muchos', 'lacitos', 'amarillos', '.', 'no', 'se', 'puede', 'ser', 'mas', 'ignorante', '.'];['respeta', 'rey', 'largate', 'casa', 'dijiste,', 'pasado', 'meses', 'podras', 'dedicar', 'tiempo', 'hacer', 'lacitos', 'amarillos.', 'no', 'puede', 'ser', 'mas', 'ignorante.']
tu eres un puerco, te falta el corral;1.0;0;0;0.0;;0;0;1;0.0;1.0;tu eres un puerco, te falta el corral;['tu', 'eres', 'un', 'puerco', ',', 'te', 'falta', 'el', 'corral'];['puerco,', 'falta', 'corral']
es que eres un pivon de amiga, asi te lo digo;0.0;0;0;0.0;;0;0;1;0.0;1.0;es que eres un pivon de amiga, asi te lo digo;['es', 'que', 'eres', 'un', 'pivon', 'de', 'amiga', ',', 'asi', 'te', 'lo', 'digo'];['pivon', 'amiga,', 'asi', 'digo']
eres un sollll;0.0;0;3;1.0;;0;0;0;0.0;1.0;eres un sollll;['eres', 'un', 'sollll'];['sollll']
eres un sinverguenza;0.0;0;0;0.0;;0;0;1;0.0;1.0;eres un sinverguenza;['eres', 'un', 'sinverguenza'];['sinverguenza']
eres un angel;0.0;0;0;0.0;;0;0;1;0.0;1.0;eres un angel;['eres', 'un', 'angel'];['angel']
te reto a un pvp con mi mando dañado por que no funciona el l2 y lo configure y ahora apunto con l1 y es dificil pero quiero ver si me ganas estoy como luis_solano-1998 es de epic y si me ganas hago un video dicendote que te amo y que eres un crack jajaj;0.0;0;0;0.0;;0;0;1;0.0;1.0;te reto a un pvp con mi mando dañado por que no funciona el l2 y lo configure y ahora apunto con l1 y es dificil pero quiero ver si me ganas estoy como luis_solano-1998 es de epic y si me ganas hago un video dicendote que te amo y que eres un crack jajaj;['te', 'reto', 'a', 'un', 'pvp', 'con', 'mi', 'mando', 'dañado', 'por', 'que', 'no', 'funciona', 'el', 'l2', 'y', 'lo', 'configure', 'y', 'ahora', 'apunto', 'con', 'l1', 'y', 'es', 'dificil', 'pero', 'quiero', 'ver', 'si', 'me', 'ganas', 'estoy', 'como', 'luis_solano-1998', 'es', 'de', 'epic', 'y', 'si', 'me', 'ganas', 'hago', 'un', 'video', 'dicendote', 'que', 'te', 'amo', 'y', 'que', 'eres', 'un', 'crack', 'jajaj'];['reto', 'pvp', 'mando', 'dañado', 'no', 'funciona', 'l2', 'configure', 'ahora', 'apunto', 'l1', 'dificil', 'quiero', 'ver', 'ganas', 'luis_solano-1998', 'epic', 'ganas', 'hago', 'video', 'dicendote', 'amo', 'crack', 'jajaj']
en serio eres un amor;0.0;0;0;0.0;;0;0;1;0.0;1.0;en serio eres un amor;['en', 'serio', 'eres', 'un', 'amor'];['serio', 'amor']
es que eres un puto genio;0.0;0;0;0.0;;0;1;1;0.0;1.0;es que eres un puto genio;['es', 'que', 'eres', 'un', 'puto', 'genio'];['puto', 'genio']
callate, eres un bot;0.0;0;0;0.0;;0;0;1;0.0;1.0;callate, eres un bot;['callate', ',', 'eres', 'un', 'bot'];['callate,', 'bot']
ya eres un anciano;0.0;0;0;0.0;;0;0;1;0.0;1.0;ya eres un anciano;['ya', 'eres', 'un', 'anciano'];['anciano']
si pactas con etarras... eres un hijo de puta. asi de claro 😂.;1.0;0;0;0.0;😂;1;0;1;0.221;1.0;si pactas con etarras... eres un hijo de puta. asi de claro 😂.;['si', 'pactas', 'con', 'etarras', '...', 'eres', 'un', 'hijo', 'de', 'puta', '.', 'asi', 'de', 'claro', '😂', '.'];['pactas', 'etarras...', 'hijo', 'puta.', 'asi', 'claro', '😂.']
la histerica, la loca y la feminazi: las nuevas etiquetas para la mujer intelectualmente inquieta.;1.0;0;0;0.0;;0;0;0;0.0;0.0;la histerica, la loca y la feminazi: las nuevas etiquetas para la mujer intelectualmente inquieta.;['la', 'histerica', ',', 'la', 'loca', 'y', 'la', 'feminazi', ':', 'las', 'nuevas', 'etiquetas', 'para', 'la', 'mujer', 'intelectualmente', 'inquieta', '.'];['histerica,', 'loca', 'feminazi:', 'nuevas', 'etiquetas', 'mujer', 'intelectualmente', 'inquieta.']
la feminazi del dia... en serio, se nos va de las manos...;1.0;0;0;0.0;;0;1;0;0.0;0.0;la feminazi del dia... en serio, se nos va de las manos...;['la', 'feminazi', 'del', 'dia', '...', 'en', 'serio', ',', 'se', 'nos', 'va', 'de', 'las', 'manos', '...'];['feminazi', 'dia...', 'serio,', 'manos...']
respuesta a un intelectual sobre por que utilizo el termino feminazi;1.0;0;0;0.0;;0;1;1;0.0;1.0;respuesta a un intelectual sobre por que utilizo el termino feminazi;['respuesta', 'a', 'un', 'intelectual', 'sobre', 'por', 'que', 'utilizo', 'el', 'termino', 'feminazi'];['respuesta', 'intelectual', 'utilizo', 'termino', 'feminazi']
feminazi no se, pero gilipollas te aseguro que si;1.0;0;0;0.0;;0;1;0;0.0;0.0;feminazi no se, pero gilipollas te aseguro que si;['feminazi', 'no', 'se', ',', 'pero', 'gilipollas', 'te', 'aseguro', 'que', 'si'];['feminazi', 'no', 'se,', 'gilipollas', 'aseguro']
