texto;toxico;
Sii falta poquito,me los llevo en verano,ahora son muy cortitas las vacaciones AJJAJA;0;
— Buenas tardes. Que días más ajetreados enseñando a los animales nuevos espectáculos, necesita vacaciones.;0;
Termina este miércoles y acabo de terminar mis vacaciones xD;0;
Esperando que mi papi me lleve d vacaciones ahí ;0;
Tengo familia en Berlin, mis primos se vienen el 20 de vacaciones para La Coruña, Galicia, Spain;0;
Ya quiero salirrr, necesito vacaciones jeje;0;
sólo 3 semanas para vacaciones 😭😭😭😭;0;
Las vacaciones *;0;
Se fue de vacaciones x el estrés.;0;
Me urgen unas vacaciones. Eternas.;0;
"Las vacaciones son un derecho que tiene todo trabajador para gozar de un descanso de 15 días hábiles por cada año de trabajo. Ingresa a LegalApp y conoce qué hacer en este caso. YoUsoLegalApp &gt;  ";0;
¡Ya huele a vacaciones y nuestro estilo lo sabe! 😎🌴LookSemanal RAGGED  ;0;
vamos a la playa oooo;0;playa
-Nada, día de playa- ;0;
Escuché una canción durante una hora en el camino de ida a la playa. ¿cuál canción crees que era?;0;
Espero que entrenes en la playa 😉 ;0;
Si hay sol hay playa, si hay playa hay alcohol... si hay alcohol hay sexo y si es contigo mejor🎵;0;
Necesito playa :(;0;
Mazarrón Retiran 200 kilos de basura marina en la playa de Bolnuevo ;0;
_Wv 📲:Supuse que sabía... Pero la playa no me suena. 📲:Si, si... Te veo en la playa, entonces;0;
Toda la gente de Alcasser se daba ostias hablando mal para estar en el programa. Yo no sé ni qué decir...los familiares en ese estado de shock no se darían cuenta de lo que estaban haciendo, pero con el tiempo debieron abrir los ojos y sentir aún más impotencia del poco respeto;0;programa
_ _ Moderación? Jaajajajjaja. Libertad? Para quién? Progreso???? Estamos hablando de la misma persona y del mismo programa?;0;
¿Tu seguirás con tu programa o ya hay cambios de todo inmediatos ?;0;
Porqué insisten en el programa de Vecinos vigilantes si las denuncias no las atienden, los mismos sitios siguen vendiendo sus drogas;0;
El programa pretende controlar el daño que generan en la fauna silvestre y a la agricultura campesina ;0;
🔵 Terraformación, el programa de la NASA para cambiar el clima de Marte y hacerlo habitable MedioAmbiente ;0;
Aquí os dejamos nuestro nuevo programa con la gran ayuda de nuestro amigo del gran podcast entre otros muchos. Muchas gracias. podcast Cine Stargate claqueta y accion 2x16 stargate ;0;
Si no generas el escenario Comuns-PSC, no hay Valls que valga. Comuns tiene con ERC un programa mucho más parecido que con el PSC pero escogió PSC para asegurarse a Valls. Y en política, nada es a cambio de nada. NADA.;0;
Donde están los amigos que tienen piscina 😫😫;0;piscina
Quisiera estar en una piscina, rai nau;0;
¡Yo estoy muy bien! ¡Con ganas de piscina o playa!;0;
Pedro solo baja a la piscina por las tardes, porque la socorrista del segundo turno es una chica. ;0;
Lo mejor de la noche fue meterme en la piscina , que risa jajajaja menuda panorama _cb;0;
_YT Estoy en la piscina.;0;
Asi da gusto venir a la piscina, una pasada todo, muchas gracias 🤤😍 ;0;
Ha venido uno a la piscina con la NINTENDO DS ;0;
no me vaciles que te echo de la piscina eh jajajajaj;0;
Yo opte por la piscina, siempre fui más de agua!😀;0;
Yo me tiro a la piscina XD;0;
Alguien me invita a su piscina para tomar el sol estas dos semanas que vienen? _jgl 🙄🙄;0;
La ONU da un premio al Ayuntamiento de Madrid de Manuela Carmena ;0;Ayuntamiento
El nuevo Ayuntamiento de Madrid dejará de luchar contra el cambio climático ;0;
José López se dirige a la multitud concentrada frente al Ayuntamiento de Cartagena en protesta por el pacto ;0;
En la web del ayuntamiento.;0;
Pues igual que Maragall que ya tiene su puesto y su sueldo de Edil en el Ayuntamiento de Barcelona.;0;
Ayer tomamos posesión los concejales de la XI legislatura del Ayuntamiento de Argés. Es el pistoletazo de salida para trabajar muy duro estos años por los argeseñ. Vamos a realizar una oposición crítica y constructiva. Prometemos luchar por un Argés de futuro y +social. ;0;
_cordob Saluden a Andrea Levy, nueva Concejala de Cultura del Ayuntamiento de Madrid. FelizDomingo ;0;
Andrea Levy, concejala de Cultura del Ayuntamiento de Madrid. No doy. laconcejalaantropófaga pp Madrid ;0;
Problemas realísimos, como poner la ikurriña en el balcón del Ayuntamiento;0;
Ya hay alcaldes esperando en la puerta del ayuntamiento;0;
Le han impuesto el euskera astro que han echado de la escuela infantil por no querer modelo de euskera. Le han impuesto la ikurriña en el ayuntamiento, que también es su casa, la de todos.;0;
"Si hombre! A la gente humilde le irá genial la ""para"" de C's en el Ayuntamiento, ya veréis!";0;
Eso es cosa del Ayuntamiento. La ciudad por suerte no es de la Iglesia;0;
Un documental para contar cómo ha acabado el Ayuntamiento de Valencia con el colapso del colector norte por culpa de las toallitas húmedas  Lo cuenta;0;
"""El Ayuntamiento de Madrid pone a disposición de todos los carteles que han adornado la ciudad desde 2016""  diseñográfico";0;
Y muchos profesionales sin trabajo.. 😪 ;0;Trabajo
Despidos, trabajo en negro, accidentes, etc. Consulte expertos! ;0;
Es posible que haya otras formas respetables de ver la vida y el trabajo, en función de las circunstancias de cada uno. Piénsalo. En mi opinión te están quedando pelín clasistas algunas opiniones al respecto de la encuesta del Farmacéutico. Sin acritud.;0;
Un día más de trabajo es un día más cerca a mi jubilación.;0;
Buen domingo 🎼😊👍 ya verás que tú cerebro hará el trabajo :);0;
🔵 5 aspectos muy curiosos (e incluso peligrosos) de la cultura laboral en Japón Trabajo ;0;
Ofertas Trabajo Content Autocoding Specialist - Barcelona en Barcelona ;0;
Ofertas Trabajo Comercial Rrhh - Barcelona en Barcelona ;0;
Ofertas Trabajo Enfermero/A Y/O Fisioterapeuta Para Domicilios En Álava - Talent Search People en Otra ;0;
18 atajos de teclado en Illustrator que mejorarán tu flujo de trabajo  ;0;
_ La historia tiene tantas versiones como personas la cuenten;0;Historia
_BS Felicidades por hacer historia;0;
Hombre, en la F1 también corren solo dos coches.😉 Nunca en la historia había habido un campeón de F1 y WEC hasta ahora. A mi lo que acaba de hacer Fernando me parece increíble. ;0;
EE UU encadena el mayor periodo de crecimiento de su historia  vía _economia;0;
42. Criminales en el mar 🇺🇲 La historia está bien pero hubiese estado mejor en una peli no cómica. ;0;
Tal parece q salieron de una historia de terror.;0;
| Quiénes estéis de acuerdo con el hecho de que hacerse un personaje como Adolf Hitler en RP está: bien podéis darme SB directamente, de verdad os lo digo. Porque me estáis comparando al mayor genocida de la historia con una reina o un emperador. Venga hombre. xd;0;
España es... UNAI SIMÓN Y 10 MAS ESP;0;España
Se puede decir mas alto, pero no mas claro. Cs a perdido una oportunidad de oro para desmarcarse públicamente de cualquier ideología extremista. Hoy podría gobernar España, junto al PSOE imponiendo sus condiciones y haber aislado a separatistas, nacionalistas y populistas.;0;
Primo José como que no lo ve en España, De pronto no en el Barcelona, pero para el Real Madrid de zidane es perfecto, por despliegue en la cancha y recuperación de balón y sería una maravilla cubriendo la espalda de Marcelo y Carvajal;0;
Viva España !! 🙆 ;0;
Majestad: el próximo 30 de junio, consagre usted España al Sagrado Corazón via _hispanidad ;0;
_sagrera Terraprim es el Ampurdán y Cataluña es España.;0;
Ahora, mañana China y España salen mañana a darse la mano, empatan y ambas selecciones clasifican con 4 puntos. El Grupo B no cuenta. FIFAWWC;0;
📣 10 delicias que evidencian la riqueza gastronómica de España ;0;
rugby se ha proclamado campeón de las España Seven Series. ;0;
Abuchean a una concejal de Vox por jurar el cargo diciendo el nombre de San Juan de Alicante en español ;0;
"ÁBALOS Que ""asuma su papel"": ""Debería reflexionar y sobre todo en el horizonte de una investidura para España, donde creo que lo importante es que el Gobierno de España sea un gobierno sin ataduras"".";0;
Cataluña se va a independizar. No cabe ninguna duda. El intervencionismo internacional al final lo provocará. Lo único que queda es que devuelva hasta el último céntimo de lo que le dimos el resto de España, cuando le construímos el primer ferrocarril, la primera red eléctrica,;0;
Operación blanqueo a C’s ;0;Operación
Bueno, al menos no tuve una operacion JAJJAJAJAJAJJA;0;
La compleja operación salida del Real Madrid ;0;
Que orgullo que la operación la inicia una mujer, gracias mi Eliii! ;0;
yo hice la operación cancelame también;0;
Operación Salida o todo puede ser un fracaso;0;
"""RED"": Gobierno anuncia la incorporación de 183 buses eléctricos a la flota tras seis meses de operación  ";0;
Pero la gente dice que lo que tienes en la cabeza es una peluca, que perdiste todo el cabello en la operación de cambio extremo ??;0;
🔊 Podolski: “La operación ha ido bien, pero la recuperación necesitará tiempo. Espero estar mejor pronto. No olvidéis que siempre he sido un luchador” ;0;
GOOOOOOL DEL RECRE !!! VAMOS OSTIA! Tenéis a media Andalucía detrás;0;Andalucía
Las mentiras de la sangre  vía de Andalucía;0;
El vertiginoso viraje de Ciudadanos en Andalucía en 5 escenas: de apoyar al PSOE a firmar con la ultraderecha  vía _es;0;
Antonio Maíllo deja su escaño y la coordinación de IU Andalucía y solicita su reingreso como profesor de Latín  via;0;
El líder de IU Andalucía, Antonio Maíllo, deja su escaño y la política para volver a ser profesor de Latín ;0;
Pésima noticia para Andalucía La marcha de Maille ;0;
40 años el psoe en Andalucía dándole oportunidades;0;
DIPUTADOS U.PODEMOS Andalucía: 17 Madrid: 7 Baleares: 6 Aragón: 5 Asturias: 4 Canarias: 4 Extremadura: 4 La Rioja: 2 Murcia: 2 Navarra: 2 Castilla-León: 1 Castilla-LaMancha: 0 Cantabria: 0 En estos meses SÓLO vi críticas a Andalucía ...y al final es quien tiene el mejor dato ;0;
_Andalucia _prov _Rivera _Cs _Cs Es que lo de Hervias.. y eso que dicen que es el cerebro de Cs.;0;
_1 _virus Efectivamente Elecciones Andaluzas/ _ _Kichi: 584.040 votos Elecciones Generales Andalucía/ _Iglesias_ : 651.160 votos;0;
Hoy tocó ruta de senderismo. Asturias Tazones DonBosco ProyectoNatura leonesp ;0;Senderismo
Finde de ⛰🌳 . . . . . . . . . . . . NonFilters SierraDeMaría LosVélez Andalucía Senderismo Hiking Friends Traveling en Parque Natural de María Los Vélez ;0;
benditas excursiones de biología ft senderismo ;0;
Senderismo Universidad Popular de Albacete. Hasta el curso que viene. Felices vacaciones!;0;
Imágenes de la Ruta del día 15/06/19, de Senderismo por la SierraDeGuara Huesca CanariasClimb YoSoyDeCanariasClimb en Sierra de Guara ;0;
7 Rutas de senderismo en Castellón provincia ;0;
"YOGA &amp; SENDERISMO EN PICOS DE EUROPA ";0;
"Tan efímera la vida,tan corta Hoy iré a El Ávila Un poquito de senderismo no hace nada mal. Los hierbajos de hace poco han renacido y se les nota el verde en las muy pequeñas hojas;el agua del riachuelo corre con mas fuerza;los pájaros andan porái(vienen a mi casa a cada rato)";0;
¿Preparad@ para la marcha senderista Nocturna Bandolera? 🌌 🚶‍♀️🚶‍♂️ 🏁 El próximo 5 de julio salida desde Gambrinus a las 22:00 horas con un recorrido de 14kms. Más info:  Amontíllate Montilla deporte Senderismo _Montilla ;0;
Soñé que aprobaba los 100 Mt en natación .. Por favor que así sea 😭;0;Natación
Natación Dos australianos vencen al Estrecho de Gibraltar ;0;
Cuando tu colé no tiene piscina y tienes que hacer natación sincronizada... ;0;
_Alcorcon Gracias por vuestra visita, volved pronto! Y buen viaje amigos. Enhorabuena Natación TrofeoRCNDelfin;0;
La natación, un estilo de vida ;0;
Gracias Carmena por cargarte los Clubs de natación de Madrid;0;
Me sentaría enseñar natación en colegios que cubren necesidades especiales;0;
Natación en piscina olímpica. 👌👏🏊‍♂️ ;0;
Nuestro equipo de sincronizada en el Campeonato de Madrid. Natación sincro VillaviciosadeOdón ;0;
Muchas felicidades al son Campeones de España de Natación Adaptada 🏊‍♀️🏊‍♂️ Mataró maresme catalunya natacion @_FEDPC_ _DI _oficial ;0;
No hay tiempo para estar triste;0;Tiempo
Jugamos con uno menos el primer tiempo;0;
Porque todos tus tweets son tan tristes ?:(;1;Tan
¿Qué tan similares son nuestros gustos ? 10% cuartos oscuros. 10% orgías. 10% drogas. (abundan poppers, tachas, alcohol y cocaína) 10% vapores/saunas. 10% bareback (sexo sin protección) 10% sexo en baños públicos. 10% apps de ligue. 🏳️‍🌈;1;
increíble como logras tener mi atención tan fácil;0;
Acomode tan mal mis 4 almohadas anoche que hoy me desperté con alto dolor de espalda;0;
Nunk dormi tan mal como anoche;0;
Nunca me había sentido tan sola como hoy;0;
por el amor de dios necesito ese anillo de Pandora, no puede ser tan tan hermoso;0;
Que nos perdone nuestra nación por tener un gobierno tan ignorante.;1;
Day 9: Grandísimo Imbécil ;1;Grandísimo
_Abreu_ Aplausos, señor Abreu. Como el grandísimo Gustavo Bueno, pero más expeditivo. ;0;
El guionista de ese capítulo se merecia todos los premios posibles. Grandisimo! (Y muy triste);1;
El Barça no va a transferir a Dembélé y bien hecho porque es un grandísimo jugador;0;
"Casemiro sobre James: ""Sería muy importante para nosotros que regrese al Real Madrid. Ya demostró a todo el mundo que es un gran jugador. Tengo un cariño grandísimo por él, como jugador y como persona. Seguro si regresa al Real Madrid será bienvenido por todas sus cualidades"".";0;
Es un grandísimo hijo de puta. La vida te cobrará todo esto, malnacido de mierda _.;1;
Grandísimo fichaje.;0;
_ Es un bicho si, pero 29 años o casi. Mucha pasta. Pero grandisimo central;0;
"_Zaragoza_ Este de los tirantes no vale ni para payaso..Con admiracion para los grandes payasos.Este es un grandisimo chufla"".";1;
hazle un favor al BARÇA y vete a la mierda, grandísimo hijoputa. Eres el cáncer del BARÇA.;1;
Felicidades. A sido un grandísimo torneo si señor;0;
pedrerol no se puede ser mas HIPÓCRITA;1;No se puede ser más
No se puede ser mas inhumana,ud,ha leido el informe de la ONU,amnistia inter.amnistia es,pen etc.Porque no habla de los privilegips del cuñado del rey?;1;
Mejor yo diría que no se puede ser más apátrida quitando la luz todos los días a toda hora;1;
No se puede ser más bueno que Adri ;0;
No se puede ser más inútil que yo;1;
_cab75 No se puede ser más imbecil.;1;
_joan No se puede ser mas mierda ok;1;
No sé puede ser más desagradable ;1;
Jugando draven y vayne no se puede ser más guarro;1;
No se puede ser más inútil que esta directiva, se hace TT ValverdeOUT y publican que la mayoría fuimos bots franceses, de verdad creían que iban a acallar las críticas con eso? Pues aquí otro que utilizó ese hashtag sin ser un bot francés, id buscando otra excusa. BotDeCensura;1;
Respeta al Rey y lárgate a tu casa como dijiste, ya han pasado 18 meses y podras dedicar tu tiempo a hacer muchos lacitos amarillos. No se puede ser más ignorante.;1;
tú eres un puerco, te falta el corral;1;Eres un
Es que eres un pivón de amiga, así te lo digo;1;
_Tomlinson ERES UN SOLLLL;0;
eres un sinvergüenza;1;
"; Eres un ángel  ";0;
te reto a un pvp con mi mando dañado por que no funciona el L2 y lo configure y ahora apunto con L1 y es dificil pero quiero ver si me ganas estoy como luis_solano-1998 es de epic y si me ganas hago un video dicendote que te amo y que eres un crack jajaj;1;
_ En serio eres un amor;0;
Es que eres un puto genio;1;
Callate, eres un bot;1;
Ya eres un anciano;1;
Si pactas con etarras... eres un hijo de puta. Así de claro.;1;
La histérica, la loca y la feminazi: las nuevas etiquetas para la mujer intelectualmente inquieta.  ;1;Feminazi
La feminazi del dia... En serio, se nos va de las manos... ;1;
"Respuesta a un intelectual sobre por qué utilizo el término ""Feminazi"" ";1;
feminazi no se, pero gilipollas te aseguro que si ;1;
Se me hace medio feminazi el comentario y aun así lo encuentro tan atinado ;1;
Jajaja se encabronó la porcina feminazi 😂😂😂😂 ;1;
Con esa última frase, se recibió me persona de mierda. Al lado de Hitler. La real feminazi.;1;
Feminista es diferente a feminazi. Tengan eso bien clarito!;1;
Feminazi en búsqueda desesperada de atención. ¿todo bien en casa?. ;1;
perdón x no ser una feminazi~ u.u;1;
Hipócrita, feminazi, demagoga.;1;
_ Ser un buen catolico o creyente no es escandalizarse o juzgar como actuan los demas, si tanto te molesta ignorarla, no necesariamente puede ser una feminazi puede ser atea y tus principios no son los mismos que ella..... y si simplemente ignoras la sibtuacion o la sobrepasas;1;
"""Bigdata y algoritmos para predecir enfermedades o exacerbaciones.  Vía prnoticias esalud""";0;Big data
Errores que se pueden cometer al crear campañas con Big Data ;0;
El Big Data ha llegado para quedarse en el fútbol español (Real Betis y Levante UD)  vía;0;
La sub21 tiene menos tiro que el big data;1;
__ Eres el Big Data? Realmente vivimos en una simulación...;0;
Ya mismo sacan una serie nueva en Netflix... THE BIG DATA THEORY...;0;
Se llama big data no es brujería;0;
Esperemos que el Big Data de el visto bueno para el pago de la cláusula ;0;
¿Sabés lo que es BigData?. Este servicio también te lo ofrecemos en Gutbit  ;0;
Se le llama big data. ;0;
Data Science aplicada. ;0;Data science
_GS De nada, sigo con interés el mundo del Data Science.;0;
En Fcen no está Estadística Matemática? después está el de data science en computación pero ya nos vamos a otro lado.;0;
14. Silvia Ferreira, líder de Data Science en ;0;
"El ""Madrid Internet Of Things Institute"" Es el primer centro de formación postgrado 100% IoT de España. En este instituto impartirán Máster en IoT, Data Science, y un programa más empresarial; el IoT Executive. Estamos deseando ver cómo evoluciona este centro. ";0;
Todas las preguntas frecuentes del Máster Interuniversitario en Ciencia de Datos / Master in Data Science ;0;
Ánimo y suerte. No es fácil el Data Science (no me acostumbro a la forma en español).;0;
¿Qué es big data? ¿Qué es data science? ¿En qué difieren? 👉  TransformaciónDigital. ;0;
_full El Data Science ;0;
Nuevo Evento: Mini taller: Python para data science 20/06/2019 ;0;
Regresión Logística, Data Science ;0;
Charla TED sobre el uso de Data Science y la Inteligencia Artificial. DataScience Tecnología Tecnología Ver más: ;0;
Día Mundial de las Personas Refugiadas: conoce a los voluntarios de la UOC  vía;0;UOC
Has mirado la UOC? Es a distancia pero más amena, con evaluación más continua y eso;0;
Arranca en Xàbia la Escuela de Verano: Fake news y posverdad de la Cátedra de Transparencia UPV El lema de la edición es “Deconstruyedo la realidad. Impacto de las fakenews y la posverdad” y ha sido coorganizada junto a la UOC, y el . ;0;
Ole! Yo los acabé el sábado (3). (También soy víctima de la UOC);0;
Los pilares clave para impulsar tu carrera profesional son trabajar una buena marca personal y desarrollar una efectiva estrategia de networking. Ayer abordé estos dos temas en el marco del 'Encuentro UOC Alumni' en el Impact Hub Vigo. Fueron unas horas m…;0;
Ahora que termino UOC hará septiembre, quiero trastear con Unreal para hacer un juego en 2D. Recomendaciones? Más que tutoriales de Unreal, de cómo diseñar el juego, tamaños de los tiles y sprites recomendados para PC, trucos a tener en cuenta, etc ¿?;0;
Ser jefa/e de UOC implica gran responsabilidad, ahora la jefatura de Capacitacion no tiene los mismos beneficios da a entender, pero el fondo es la forma en que la denigraron y juzgaron por unas fotos.;0;
Nlp francis jajaaja ;0;NLP
Victor Kuppers, 45 minutos geniales de motivación / NLP  via;0;
_talvi Esos términos me suenan de NLP pero tendría que investigar bien. Si me tiras una punta le meto a pleno;0;
Otro reto: incorporar AI, NLP, ...;0;
A mi y a Karla nlp;0;
_nlp wow Enhorabuena Eduardo!;0;
al parecer la prepa nlp...;0;
Empuje chino para ganar la AI wef19 ArtificialIntelligence MachineLearning DeepLearning NLP carrera NLG ComputerVision armamentística Robotics _staub ;0;
Este finde tocó darle al NLP y APIcloudSpeech de Google via Rstats. Y no sé por qué acabe analizando la presentación de en 2009. Dejando a un lado el tema técnico os dejo esta perla de video donde deja claro el tema IMPUESTOS y que le pasó factura 10 años después ;0;
Emoción de lingüista: dícese cuando asistes a una masterclass de la gran , filóloga y manager general de , explica qué es la IA y la relevancia de la lingüística aplicada en este campo y sus usos en diferentes mercados. WeLoveLinguistics NLP TechTalks ;0;
